{
  "presetName": "Work M",
  "version": "1.2",
  "timestamp": "2026-06-02T21:39:27.424Z",
  "dimensions": {
    "width": 358,
    "height": 127,
    "thickness": 32,
    "unit": "mm"
  },
  "surfaces": {
    "front": {
      "visible": true,
      "rotation": 0,
      "gridMode": "main",
      "grid": {
        "module": 4.272066738428418,
        "margins": 1.364,
        "columns": 4,
        "rows": 4,
        "rowHeight": 6
      }
    },
    "left": {
      "visible": true,
      "rotation": 270,
      "gridMode": "main",
      "grid": {
        "module": 4.272066738428418,
        "margins": 1.364,
        "columns": 4,
        "rows": 4,
        "rowHeight": 6
      }
    },
    "right": {
      "visible": true,
      "rotation": 90,
      "gridMode": "main",
      "grid": {
        "module": 4.272066738428418,
        "margins": 1.364,
        "columns": 4,
        "rows": 4,
        "rowHeight": 6
      }
    },
    "top": {
      "visible": true,
      "rotation": 0,
      "gridMode": "main",
      "grid": {
        "module": 4.272066738428418,
        "margins": 1.364,
        "columns": 4,
        "rows": 4,
        "rowHeight": 6
      }
    },
    "bottom": {
      "visible": true,
      "rotation": 180,
      "gridMode": "main",
      "grid": {
        "module": 4.272066738428418,
        "margins": 1.364,
        "columns": 4,
        "rows": 4,
        "rowHeight": 6
      }
    }
  },
  "texts": [
    {
      "id": "headline",
      "content": "Клавиатура \nLunnen Work M",
      "style": "headline",
      "position": {
        "column": 1,
        "row": 0,
        "baseline": 0
      },
      "width": 1,
      "alignment": "left",
      "textAlign": "left",
      "alignmentMode": "x-height",
      "surface": "front",
      "showBounds": false,
      "visible": true,
      "lockPosition": true
    },
    {
      "id": "text",
      "content": "Lunnen — бренд компьютерной техники и аксессуаров, придуманный в Яндекс Фабрике. Сопровождает в исследованиях, работе и развлечениях.",
      "style": "text",
      "position": {
        "column": 3,
        "row": 0,
        "baseline": 0
      },
      "width": 1,
      "alignment": "left",
      "textAlign": "left",
      "alignmentMode": "x-height",
      "surface": "front",
      "showBounds": false,
      "visible": true,
      "lockPosition": true
    },
    {
      "id": "text2",
      "content": "Cерия аксессуаров для компьютерной техники Lunnen Work — подходит для работы и повседневных задач.",
      "style": "text",
      "position": {
        "column": 4,
        "row": 0,
        "baseline": 0
      },
      "width": 0.75,
      "alignment": "left",
      "textAlign": "left",
      "alignmentMode": "x-height",
      "surface": "front",
      "showBounds": false,
      "visible": true,
      "lockPosition": true
    },
    {
      "id": "text-1780425967449",
      "content": "lunnen.pro\nУзнать больше о бренде\nили связаться с поддержкой",
      "style": "text",
      "position": {
        "column": 1,
        "row": 3,
        "baseline": 4
      },
      "width": 0.75,
      "alignment": "right",
      "textAlign": "left",
      "alignmentMode": "x-height",
      "surface": "front",
      "showBounds": false,
      "visible": true,
      "lockPosition": true
    },
    {
      "id": "text-1780426483989",
      "content": "Изготовитель: Винд Мобилити Текнолоджи (Пекин) Лимитед. Адрес: офис 11605, 13 этаж, корпус 1, дом 2, переулок Наньчжугань, район Дунчэн, Пекин, Китай. Сделано в Китае.",
      "style": "text",
      "position": {
        "column": 3,
        "row": 2,
        "baseline": 0
      },
      "width": 1,
      "alignment": "left",
      "textAlign": "left",
      "alignmentMode": "x-height",
      "surface": "front",
      "showBounds": false,
      "visible": true,
      "lockPosition": true
    },
    {
      "id": "text-1780426497743",
      "content": "Импортёр/Организация, принимающая претензии на территории РФ: ООО «Маркет. Трейд». Адрес: \n121099, Россия, г. Москва, Новинский б-р, д. 8. \nInfo@lunnen.pro",
      "style": "text",
      "position": {
        "column": 4,
        "row": 2,
        "baseline": 0
      },
      "width": 1,
      "alignment": "left",
      "textAlign": "left",
      "alignmentMode": "x-height",
      "surface": "front",
      "showBounds": false,
      "visible": true,
      "lockPosition": true
    },
    {
      "id": "text-1780427771951",
      "content": "Ножничная\nклавиатура",
      "style": "headline",
      "position": {
        "column": 1,
        "row": 1,
        "baseline": 0
      },
      "width": 1,
      "alignment": "left",
      "textAlign": "left",
      "alignmentMode": "x-height",
      "surface": "front",
      "showBounds": false,
      "visible": true,
      "lockPosition": true
    },
    {
      "id": "text-1780427816937",
      "content": "Экспедиция начинается",
      "style": "text",
      "position": {
        "column": 3,
        "row": 1,
        "baseline": 0
      },
      "width": 1,
      "alignment": "left",
      "textAlign": "left",
      "alignmentMode": "x-height",
      "surface": "front",
      "showBounds": false,
      "visible": true,
      "lockPosition": true
    },
    {
      "id": "text-1780427855098",
      "content": "89 клавиш ",
      "style": "headline",
      "position": {
        "column": 1,
        "row": 2,
        "baseline": 0
      },
      "width": 1,
      "alignment": "left",
      "textAlign": "left",
      "alignmentMode": "x-height",
      "surface": "front",
      "showBounds": false,
      "visible": true,
      "lockPosition": true
    },
    {
      "id": "text-1780427878949",
      "content": "*M — размер medium, \nсредний",
      "style": "text",
      "position": {
        "column": 4,
        "row": 1,
        "baseline": 0
      },
      "width": 1,
      "alignment": "left",
      "textAlign": "left",
      "alignmentMode": "x-height",
      "surface": "front",
      "showBounds": false,
      "visible": true,
      "lockPosition": true
    }
  ],
  "grid": {
    "module": 4.272066738428418,
    "margins": 1.364,
    "marginsUnit": "mm",
    "columns": 4,
    "rows": 4,
    "rowHeight": 6,
    "linkMode": "module",
    "locks": {
      "module": false,
      "margins": false,
      "moduleValue": null,
      "marginsValue": null
    },
    "visibility": {
      "columns": true,
      "rows": true,
      "baseline": true
    }
  },
  "colors": {
    "background": "#b59579"
  },
  "typography": {
    "units": {
      "size": "mod",
      "lineHeight": "mod"
    },
    "headline": {
      "size": 0.88,
      "lineHeight": 1.37,
      "tracking": -0.015,
      "useXHeight": false,
      "fontWeight": 500
    },
    "text": {
      "size": 0.5,
      "lineHeight": 0.82,
      "tracking": 0,
      "useXHeight": false,
      "fontWeight": 500
    },
    "caption": {
      "size": 0.5,
      "lineHeight": 1,
      "tracking": 0,
      "useXHeight": false,
      "fontWeight": 500
    },
    "lunnenDisplay": {
      "size": 3,
      "lineHeight": 4,
      "tracking": 0,
      "useXHeight": false
    }
  },
  "display": {
    "dimensions": false,
    "labels": false,
    "sidePanels": true,
    "objects": true
  },
  "graphics": {
    "blocks": [
      {
        "id": "graphics-1769024205782",
        "name": "lunnen_logo",
        "position": {
          "column": 2,
          "row": 3,
          "baseline": 4
        },
        "height": 2,
        "widthInColumns": 0.86,
        "widthInModules": null,
        "sizeMode": "height",
        "originalWidth": 195.7229156,
        "originalHeight": 28.3464565,
        "alignment": "left",
        "surface": "front",
        "showBounds": false,
        "visible": true,
        "lockPosition": true,